{
  "$schema": "https://json-schema.org/draft/2020-12/schema",
  "$id": "urn:intdata:schema:release-verification-key-set:v1",
  "title": "ReleaseVerificationKeySetV1",
  "$comment": "Canonical RFC 8785 payload for standard DSSE payloadType application/vnd.intdata.release-keyset.v1+json. Acceptance additionally requires a 2-of-3 distinct release.trust.root quorum from the immutable out-of-band root set pinned by bootstrap and InstallationLockV1.",
  "type": "object",
  "additionalProperties": false,
  "required": [
    "schema_version",
    "revision",
    "previous_digest",
    "generated_at",
    "bootstrap_root_set_digest",
    "keys"
  ],
  "properties": {
    "schema_version": { "const": "ReleaseVerificationKeySetV1" },
    "revision": { "$ref": "#/$defs/positive_safe_integer" },
    "previous_digest": {
      "oneOf": [
        { "$ref": "#/$defs/tagged_sha256" },
        { "type": "null" }
      ]
    },
    "generated_at": { "$ref": "#/$defs/timestamp" },
    "bootstrap_root_set_digest": { "$ref": "#/$defs/sha256" },
    "keys": {
      "type": "array",
      "minItems": 1,
      "maxItems": 128,
      "items": { "$ref": "#/$defs/key" }
    }
  },
  "allOf": [
    {
      "if": {
        "required": ["revision"],
        "properties": { "revision": { "const": 1 } }
      },
      "then": { "properties": { "previous_digest": { "type": "null" } } },
      "else": { "properties": { "previous_digest": { "$ref": "#/$defs/tagged_sha256" } } }
    }
  ],
  "$defs": {
    "identifier": {
      "type": "string",
      "minLength": 1,
      "maxLength": 128,
      "pattern": "^[a-z][a-z0-9]*(?:[._:-][a-z0-9]+)*$"
    },
    "sha256": { "type": "string", "pattern": "^[a-f0-9]{64}$" },
    "tagged_sha256": { "type": "string", "pattern": "^sha256:[a-f0-9]{64}$" },
    "positive_safe_integer": { "type": "integer", "minimum": 1, "maximum": 9007199254740991 },
    "timestamp": {
      "type": "string",
      "format": "date-time",
      "pattern": "^\\d{4}-\\d{2}-\\d{2}T\\d{2}:\\d{2}:\\d{2}Z$"
    },
    "nullable_timestamp": {
      "oneOf": [
        { "$ref": "#/$defs/timestamp" },
        { "type": "null" }
      ]
    },
    "nullable_reason": {
      "oneOf": [
        { "type": "string", "minLength": 1, "maxLength": 256 },
        { "type": "null" }
      ]
    },
    "key": {
      "type": "object",
      "additionalProperties": false,
      "required": [
        "key_id",
        "role",
        "algorithm",
        "public_key_base64",
        "state",
        "valid_from",
        "valid_until",
        "retired_at",
        "retirement_reason",
        "revoked_at",
        "revocation_reason"
      ],
      "properties": {
        "key_id": { "type": "string", "pattern": "^[A-Za-z0-9._-]{1,128}$" },
        "role": { "const": "release.artifact.signing" },
        "algorithm": { "const": "Ed25519" },
        "public_key_base64": { "type": "string", "pattern": "^[A-Za-z0-9+/]{43}=$" },
        "state": { "enum": ["active", "retired", "revoked"] },
        "valid_from": { "$ref": "#/$defs/timestamp" },
        "valid_until": { "$ref": "#/$defs/timestamp" },
        "retired_at": { "$ref": "#/$defs/nullable_timestamp" },
        "retirement_reason": { "$ref": "#/$defs/nullable_reason" },
        "revoked_at": { "$ref": "#/$defs/nullable_timestamp" },
        "revocation_reason": { "$ref": "#/$defs/nullable_reason" }
      },
      "allOf": [
        {
          "if": { "required": ["state"], "properties": { "state": { "const": "active" } } },
          "then": {
            "properties": {
              "retired_at": { "type": "null" },
              "retirement_reason": { "type": "null" },
              "revoked_at": { "type": "null" },
              "revocation_reason": { "type": "null" }
            }
          }
        },
        {
          "if": { "required": ["state"], "properties": { "state": { "const": "retired" } } },
          "then": {
            "properties": {
              "retired_at": { "$ref": "#/$defs/timestamp" },
              "retirement_reason": { "type": "string", "minLength": 1, "maxLength": 256 },
              "revoked_at": { "type": "null" },
              "revocation_reason": { "type": "null" }
            }
          }
        },
        {
          "if": { "required": ["state"], "properties": { "state": { "const": "revoked" } } },
          "then": {
            "properties": {
              "revoked_at": { "$ref": "#/$defs/timestamp" },
              "revocation_reason": { "type": "string", "minLength": 1, "maxLength": 256 }
            }
          }
        },
        {
          "if": {
            "required": ["state", "retired_at"],
            "properties": {
              "state": { "const": "revoked" },
              "retired_at": { "$ref": "#/$defs/timestamp" }
            }
          },
          "then": {
            "properties": {
              "retirement_reason": { "type": "string", "minLength": 1, "maxLength": 256 }
            }
          },
          "else": {
            "if": {
              "required": ["state"],
              "properties": { "state": { "const": "revoked" } }
            },
            "then": { "properties": { "retirement_reason": { "type": "null" } } }
          }
        }
      ]
    }
  }
}
