{
  "schema_version": "ReleaseVerificationKeySetV1",
  "revision": 1,
  "previous_digest": null,
  "generated_at": "2026-08-10T12:06:00Z",
  "bootstrap_root_set_digest": "97ef2cc9b43908a6be6e7b3c91680f75f9e4cbec15828056bec6f024d966e531",
  "keys": [
    {
      "key_id": "release.active",
      "role": "release.artifact.signing",
      "algorithm": "Ed25519",
      "public_key_base64": "DAwMDAwMDAwMDAwMDAwMDAwMDAwMDAwMDAwMDAwMDAw=",
      "state": "active",
      "valid_from": "2026-08-11T00:00:00Z",
      "valid_until": "2027-08-11T00:00:00Z",
      "retired_at": null,
      "retirement_reason": null,
      "revoked_at": null,
      "revocation_reason": null
    }
  ]
}
